{
  "schema_version": "pm.plan.technology/v1",
  "label": "Selected475 choices using current root research and still-valid473 exact pins; no application execution",
  "rows": [
    {
      "id": "TD01",
      "name": "Go",
      "version": "1.27.1",
      "owner": "all Go processes/tools",
      "purpose": "Standard HTTP/TLS, exact JSON wrappers, math/big, crypto/rand and AES-GCM envelope encryption; test/fuzz/synctest, vet and race.",
      "primary_source": "https://go.dev/doc/devel/release#go1.27.0",
      "license": "BSD-3-Clause",
      "constraints": "PM encryption rotates below per-key random-nonce usage bound; allowlisted redaction required. No default provider replay assumption.",
      "prior_id": "T01/T16/T19/T20/T21",
      "status": "selected proposal; combined build/integration UNEXECUTED"
    },
    {
      "id": "TD02",
      "name": "Gin",
      "version": "1.12.0",
      "owner": "httpapi",
      "purpose": "Route grouping and strict generated adapter.",
      "primary_source": "https://github.com/gin-gonic/gin/tree/73726dc606796a025971fe451f0aa6f1b9b847f6",
      "license": "MIT",
      "constraints": "Override trust-proxy/binding/recovery; Request.Context only beyond adapter.",
      "prior_id": "T01 replacement",
      "status": "selected proposal; combined build/integration UNEXECUTED"
    },
    {
      "id": "TD03",
      "name": "github.com/oapi-codegen/oapi-codegen/v2",
      "version": "v2.8.0",
      "owner": "tools",
      "purpose": "Generate Go DTO/client and strict Gin from authored public OpenAPI3.1.",
      "primary_source": "https://github.com/oapi-codegen/oapi-codegen/tree/de2d8b2b0afb287198554eb305bb0d2687d26a85",
      "license": "Apache-2.0",
      "constraints": "Test admitted3.1 subset; duplicate/allOf-loss and full schema validation remain PM obligations. Separate tools module graph.",
      "prior_id": "T02",
      "status": "selected proposal; combined build/integration UNEXECUTED",
      "source_archive_sha256": "03573aa38a582dbe55b946e87b4d6059742b74db496242849bbe14b260cec939",
      "commit": "de2d8b2b0afb287198554eb305bb0d2687d26a85"
    },
    {
      "id": "TD04",
      "name": "github.com/oapi-codegen/runtime",
      "version": "v1.7.0",
      "owner": "api/httpapi",
      "purpose": "Runtime support for generated Go API code.",
      "primary_source": "https://github.com/oapi-codegen/runtime/tree/25e2d353ccbf722e1d991ff71beb9502a421d665",
      "license": "Apache-2.0",
      "constraints": "Generated helpers do not replace permission/schema validation.",
      "prior_id": "T02 support",
      "status": "selected proposal; combined build/integration UNEXECUTED",
      "source_archive_sha256": "cd296c9a4b9d6d8e47de57c3e07b4f192ce5188253f8c29581f380404f99bb4b",
      "commit": "25e2d353ccbf722e1d991ff71beb9502a421d665"
    },
    {
      "id": "TD05",
      "name": "github.com/getkin/kin-openapi",
      "version": "v0.149.0",
      "owner": "compile/tools",
      "purpose": "OpenAPI2/3 parsing, explicit Swagger conversion and source-origin references.",
      "primary_source": "https://github.com/getkin/kin-openapi/tree/1a812b4b73ede7fa295c63a5c89d1ca7250dcc07",
      "license": "MIT",
      "constraints": "Closed captured-resource loader; custom ReadFromURIFunc must reject unknown refs itself; reject unsupported dialects/shapes.",
      "prior_id": "T03",
      "status": "selected proposal; combined build/integration UNEXECUTED",
      "source_archive_sha256": "4288d89c8e76c6406509bfc48608704ddc8a07cdc0a141511f91a7f41b35f50d",
      "commit": "1a812b4b73ede7fa295c63a5c89d1ca7250dcc07"
    },
    {
      "id": "TD06",
      "name": "github.com/santhosh-tekuri/jsonschema/v6",
      "version": "v6.0.3",
      "owner": "contract/schema/httpapi",
      "purpose": "Canonical JSON Schema2020-12 and admitted provider schema validation.",
      "primary_source": "https://github.com/santhosh-tekuri/jsonschema/tree/b0fc661f4939578bc429f408c18202573dbafcc4",
      "license": "Apache-2.0",
      "constraints": "Pin draft and format/content assertion policy; bounded recursion/number fidelity; no network loader.",
      "prior_id": "T04",
      "status": "selected proposal; combined build/integration UNEXECUTED",
      "source_archive_sha256": "79282583888de6fd146e513f01e09bd3b228976942d2114688e97608279b1ebe",
      "commit": "b0fc661f4939578bc429f408c18202573dbafcc4"
    },
    {
      "id": "TD07",
      "name": "go.yaml.in/yaml/v3",
      "version": "v3.0.5",
      "owner": "compile/tools",
      "purpose": "YAML AST for provider/API source loading with line/pointer provenance.",
      "primary_source": "https://github.com/yaml/go-yaml/tree/e16c7af9361b241fa02d91582fb59ce4954d8afc",
      "license": "MIT/Apache-2.0 file-specific",
      "constraints": "Reject duplicate/non-string keys, unsupported tags and excessive aliases before normalization.",
      "prior_id": "T05",
      "status": "selected proposal; combined build/integration UNEXECUTED",
      "source_archive_sha256": "f2d70caa35f66283aec58b889af8c5f07c374c5934be27a738c1215263e19205",
      "commit": "e16c7af9361b241fa02d91582fb59ce4954d8afc"
    },
    {
      "id": "TD08",
      "name": "github.com/spf13/cobra",
      "version": "v1.10.2",
      "owner": "cli",
      "purpose": "Real static/dynamic command tree, help/completion and presence-aware flags.",
      "primary_source": "https://github.com/spf13/cobra/tree/88b30ab89da2d0d0abb153818746c5a2d30eccec",
      "license": "Apache-2.0",
      "constraints": "Strict encoding/json config instead of Viper; explicit workspace and reserved aliases.",
      "prior_id": "T06",
      "status": "selected proposal; combined build/integration UNEXECUTED",
      "source_archive_sha256": "a00aae6fcd631e0fde52c98604452ff70e1b73c3b8a560d68db15aff5e26872d",
      "commit": "88b30ab89da2d0d0abb153818746c5a2d30eccec"
    },
    {
      "id": "TD09",
      "name": "github.com/jackc/pgx/v5",
      "version": "v5.11.0",
      "owner": "store/runtime",
      "purpose": "Separate PM PG pools and customer PostgreSQL typed native transport/COPY.",
      "primary_source": "https://github.com/jackc/pgx/tree/5e583fa7aabfa88b796292f849fc9d7d75ac159d",
      "license": "MIT",
      "constraints": "Different DB/roles/connection identities; codecs/timezones/query mode and ambiguity tested.",
      "prior_id": "T08",
      "status": "selected proposal; combined build/integration UNEXECUTED",
      "source_archive_sha256": "ada62e95244336484f86c274e04a6845f0c494c93b69d24f2ac4181b7c58b11d",
      "commit": "5e583fa7aabfa88b796292f849fc9d7d75ac159d"
    },
    {
      "id": "TD10",
      "name": "PostgreSQL",
      "version": "16.15",
      "owner": "operator/store",
      "purpose": "Canonical pm_app; separately owned Temporal persistence/visibility and filer metadata databases.",
      "primary_source": "https://github.com/postgres/postgres/tree/7d3e000c5961a544302072058a1184e9a588837b",
      "license": "PostgreSQL License",
      "constraints": "Chosen documented tested major; exact patch/image/schema/roles integration still required.",
      "prior_id": "T07/T08 replacement",
      "status": "selected proposal; combined build/integration UNEXECUTED"
    },
    {
      "id": "TD11",
      "name": "github.com/pressly/goose/v3",
      "version": "v3.28.0",
      "owner": "store/migration job",
      "purpose": "Embedded ordered PostgreSQL SQL migrations only.",
      "primary_source": "https://github.com/pressly/goose/tree/43d2d9c819ed6c9ba2b67a86bdf9fc08562495b7",
      "license": "MIT",
      "constraints": "Disable env interpolation; isolated migrator, no automatic destructive Down. PM never migrates Temporal/filer tables.",
      "prior_id": "T09",
      "status": "selected proposal; combined build/integration UNEXECUTED",
      "source_archive_sha256": "0a3449f50109b9b85aa4bf4e191d5fe701b6e250997213184971a35b31a204d5",
      "commit": "43d2d9c819ed6c9ba2b67a86bdf9fc08562495b7"
    },
    {
      "id": "TD12",
      "name": "Temporal Server / Go SDK / API Go",
      "version": "1.31.2 / 1.48.0 / 1.63.4",
      "owner": "temporal/workflows/activities",
      "purpose": "Durable orchestration, timers, schedules, versioned workers and handoff APIs.",
      "primary_source": "https://github.com/temporalio/sdk-go/tree/b7c242c6894df088a57a85b33d0586e908da8b93",
      "license": "MIT",
      "constraints": "Server commit19a774302c613da9adc4436ab14278ccdca8e0a5; API commit60e39586a91fbf101a8763293ad55dae4fbb9f49. Determinism, history, CAS, retention and explicit policy required.",
      "prior_id": "T11/T12 replacement",
      "status": "selected proposal; combined build/integration UNEXECUTED"
    },
    {
      "id": "TD13",
      "name": "github.com/duckdb/duckdb-go/v2",
      "version": "v2.10505.0",
      "owner": "analytics child only",
      "purpose": "DuckDB1.5.5 query and Parquet materialization.",
      "primary_source": "https://github.com/duckdb/duckdb-go/tree/36040984c722e0f174b880eb7d77e238b3d8bc61",
      "license": "MIT",
      "constraints": "Native cgo only in pm-query; no shared writable file; process/AST/secret/file bounds.",
      "prior_id": "T10 replacement",
      "status": "selected proposal; combined build/integration UNEXECUTED",
      "source_archive_sha256": "afa622810aa5cb65e4acafcbb6d95db9936e98329c743d9d9eff8ce521af470c",
      "commit": "36040984c722e0f174b880eb7d77e238b3d8bc61"
    },
    {
      "id": "TD14",
      "name": "SeaweedFS / AWS S3 SDK",
      "version": "4.46 / service/s3 v1.113.0",
      "owner": "objects/operator",
      "purpose": "One S3 immutable artifact contract; PostgreSQL filer metadata.",
      "primary_source": "https://github.com/seaweedfs/seaweedfs/tree/d997fba1575583a89cf0cc50dc0150642286c86d",
      "license": "Apache-2.0",
      "constraints": "SDK commitb189f382f4924bc6c948c9942e17c547553faf0d pins rootSDK1.47.0/Smithy1.28.1. Pool/listing, multipart and digest behavior qualified; unique attempt keys.",
      "prior_id": "new475",